{
  "$schema": "http://json-schema.org/draft-07/schema#",
  "$id": "platform.schema.json",
  "title": "Platform",
  "type": "object",
  "required": ["name", "framework"],
  "additionalProperties": false,
  "properties": {
    "$schema":     { "type": "string" },
    "name":        { "type": "string" },
    "displayName": { "type": "string" },
    "framework":   { "type": "string" },
    "language":    { "type": "string" },
    "iconSet":     { "type": "string" },
    "screensRoot": { "type": "string" },
    "overlaysRoot":{ "type": "string" },
    "capabilities":{ "type": "object", "additionalProperties": { "type": "boolean" } }
  }
}
